{
    "$id": "https://githb.com/jtschichold/mm-cloud-services-miners/BGPViewASNPrefixMiner.schema.json",
    "$schema": "http://json-schema.org/draft-07/schema#",
    "type": "array",
    "minItems": 1,
    "items": {
        "type": "object",
        "properties": {
            "prefix": {
                "type": "string"
            },
            "name": {
                "type": "string"
            },
            "description": {
                "type": "string"
            },
            "roa_status": {
                "type": "string"
            },
            "country_code": {
                "type": "string"
            }
        },
        "required": ["prefix"]
    }
}